{"abstract":"This research candidate starts from 1 certified result and the proved Intuition bridge advisory/trace-norm-interaction. It proposes a focused study of trace and norm compatibility under conjugation. Certified metadata and the candidate mathematical claim are kept separate: the latter is conjectured until independently checked and admitted to a certified release.","grounded_on":{"certified_node_ids":["sha256:7804b44f3f41b724896f751b7806927eca860dd10c177e6105ecd8570a3c9aef"],"proved_bridge_refs":["paper-intuition-port.v1@sha256:1fde9beb7d1999d06c042d24b57e18caea67612f209d725b5eb931addccb0e46#advisory/trace-norm-interaction"]},"key_claims":[{"claim":"The certified release records D5/S0/Carrier/TraceConjugation.trace_conj as a theorem with statement identity sha256:1ab96b4bf35982c1c1e3c9ef01d916fa2547b0166636e475fb3ee3970c06810a.","kind":"certified","source_ref":"paper-truth-release-port.v1@sha256:1fde9beb7d1999d06c042d24b57e18caea67612f209d725b5eb931addccb0e46#D5/S0/Carrier/TraceConjugation.trace_conj"},{"claim":"Trace and norm compatibility under conjugation","kind":"conjectured","source_ref":"paper-intuition-port.v1@sha256:1fde9beb7d1999d06c042d24b57e18caea67612f209d725b5eb931addccb0e46#advisory/trace-norm-interaction"}],"outline":["Certified foundations and provenance","Statement of the candidate bridge","Prior literature and novelty boundary","Proof strategy and falsification conditions","Consequences and certification plan"],"schema":"candidate-paper.v1","structural_context":{"advisory":"Certified structural context only; it does not certify candidate claims and does not alter the Paper claim gate.","algorithm_profile_digest":null,"availability":"unavailable","key_nodes":[],"producer_commit":null,"truth_release_digest":"sha256:1fde9beb7d1999d06c042d24b57e18caea67612f209d725b5eb931addccb0e46"},"thesis":"The certified results may support a precise theorem about trace and norm compatibility under conjugation; the bridge remains a research claim until it enters the certified truth release.","title":"Trace and norm compatibility under conjugation"}